review_text,user_score,recommendation,review_date,entity,series_component,series_id,review_id,page_number
"To be honest, Naruto is the most overhyped show in existence. Everyone goes on and on and on about how great it is; and my expectations for this show was equally high. However, I was really, really let down. Really. This wasn't the best show ever, as I had thought it would be. Don't get me wrong, the show is enjoyable, but it's definitely not among the best shows out there. I hope Shippuden will better than this... much better. The concept of this show isn't that hard to follow. It's an alternate world in which ninjas live. The ninjas fight by using various skills, and they have this power flowing inside of them called chakra. Chakra is used to perform powerful attacks which (usually) belongs to either of the five traditional elements of earth, fire, water, air and lightning. Of course, since they are ninjas, they fight with weapons like shuriken and kunai as well as hand-to-hand combat. As expected of this kind of world, there's evil people, having different goals and reasons behind their evil. The story follows Naruto, one of these ninjas, as he grow as a ninja, from being a stupid little prank-playing brat to becoming a fine ninja. Along the way, he interacts with and makes friends with many fellow ninja, fighting his way towards his dream of becoming Hokage (the leader of his village). The story isn't nearly as good as the concept would indicate. Sure, a lot of the characters has some nice background stories, won't complain about that, but they manage to drag out everything so much. It really annoys me. Some fights take several episodes when they could've been done them just as good in one or two. There's also way too much fighting. The story goes like fight, fight, background story, fight, fight, even more fight, half an episode's worth of resting or journeying, fight, fight, and so on. I mean, it's cool to watch fights, but there are just way too many fights, and they drag most of them out to unnecessary lengths. The only really enjoyable fight was the one between Sasuke and Naruto right before the fillers began. Which brings up another thing... Fillers! Agh, I normally don't mind fillers, but Naruto had some really, really stupid ones. Sure, there was the occasional diamond among the charcoal, but that doesn't excuse the high amount of bad fillers. I mean, just because they are fillers doesn't mean that they have to make them bad. Several shows have actually made decent and at the same time long fillers (especially Bleach, with its 40-episode long Bount arc), but Naruto failed horribly here. Also, I feel that Naruto is very silly at times. Silly is usually good, but not when it's immature silly. And guess what+ Naruto is silly in an immature way. It's so dreadfully stupid at times that I had to close my eyes, take a deep breath and wait until it got serious again. Now, it did have some good comical moments, but those were far and wide between. Another thing I feel like releasing my rage on is the animation. It barely manages to get the description &ldquo;average&rdquo; to me. At its best, it's slightly above average. However, a lot of time it's slipshod galore with the animation. I still have many very bad memories from having to watch lots of errors in the animation, and I'm not sure if I'll ever get rid of those memories. While the amount of errors decreased as the episodes passed by, at least every second episode before the 100s had one or more moments of slipshod animation. Wonder if they ever considered firing the animators. As a side mention, they should do something about Rock Lee - even though I've slightly gotten used to his horrible looks, I still feel a burn in the back of my eye every time I see him. The music is pretty good, though. A lot of great tunes (especially the sad ones are great), and the first few OPs and EDs were pretty awesome. It has some really bad music parts too, like the tribal voice-ish song, and sometimes they could've used better themes during the fights. As the series progressed, the quality of the OPs and EDs decrease too. The characters are fairly okay, I guess. Some of them are really annoying, like Naruto, because he's so stupid. Agh, he annoys me to no end! Some other characters are annoying too, because of things like their looks (Gai and Lee), or because they are failed attempts at comical relief (at least in my eyes, you might find them funny), like the all too perverted Jiraiya. That's the negative about them. However, they have some really nice background stories, some which are elaborated more upon than others. Many of the characters also get fair amounts of screen time, which for some people can seem too much, whilst others will be content with it, because their favorite character from the show gets an episode for him/herself. I also like the fact that most of them have dreams or aspirations, and motives for what they are doing and how they are acting (usually it's tied together with their background stories). The growing relationships between them is also nice, their maturing, and how Naruto is slowly getting accepted by more and more people through hard work. Basically, they've portrayed the characters very well, and not too over the top, but some of them act stupid and silly from time to time, which drags the character rating down. I have some mixed feelings for the show, which kind of drags down on the enjoyability factor of it. Great concept, not as good story, both good and bad music, horrid animation at times, many characters with background stories, some of them great and some not-so-great; it's hard to completely make up my mind, but I believe the ratings I have given shows my feelings towards the different aspects of the show. Of course, even though there was things I didn't like, I can easily see why this show is so popular as it is; it has humor that the kids may find funny, as well as lots of fights which appeal to the teenagers and adults. I personally didn't like it that much, though. I'm looking forward to Shippuden, because I&rsquo;ve heard it was much better&hellip; I really hope so! To 'Not Helpful' voters (and you 'Helpful' voters too): Feedback greatly appreciated =)",7,Recommended,"Apr 27, 2008",Naruto,Naruto,20,naruto_fd05465624,1
"I began to browse through the reviews of Naruto, and realized something was horribly wrong. All the experienced anime watchers were giving it crappy reviews, and all the first-timers were giving it rave reviews, with reasons that every anime has to back them up. How could this be? Gee, I wonder. For some strange reason, Naruto has become the most popular and well-known anime series ever, and as such, it is usually the first anime seen by anime watchers alike. Why this is, I don't know. Maybe it appeals to a wide variety of young teenagers... When I was 13 years old, I remember watching and loving this anime. I had never seen any other anime shows, and I thought the concept was original and amazing. When I found out that others animes literally had all that Naruto had plus a lot more, I was... bored with all the fillers. At the time the anime was great, but it really does get old. Then again, the anime is not absolutely horrible. It has the essentials, with a somewhat unique story and art style. The characters are cliche, and enjoyment is there but short and sweet. What I truly love about Naruto is the great soundtrack. It seems that all the OP and ED are just fabulous, and the music just fits within the series. I would have liked a bit of a change over the course of the show, but hey, it almost never happens. All in all, it was a good show. Just good. So basically: Shame on those people who watch 10 episodes and immediately come here and write a review. Also shame on people who give this show all 1's because everyone else loves it. It's OK, but ive definitely seen better.",7,Recommended,"Jun 25, 2008",Naruto,Naruto,20,naruto_29452877f3,1
"Naruto, yes Naruto. One of the series that has defined the cultural shonen’s of the last generation in the history of anime. This is a series that has changed significantly over the past decade. What I love bout naruto is the whole “Ninja aspect” of the show. Every technique had substance, quality and all of the training arcs really shown the defining elements of how ninjutsu worked within the naruto universe. These qualities are something I will soon not forget. I know alot of people complain about naruto being a half ass wit that can’t do nothing Or perhaps sakura being useless. But in away I look at the series as being a little different, especially in the developing of characters. Kishimoto did not intend to create the story with a “bad ass” character right from the start, toppling villains one after the other, no. Naruto was set up in a way that much resembles an ordinary life and the tribulations and tests you must go through. Death is at every corner and naruto is a kid that is trying to fit in with the rest of the shinobi and be ""recognized"" I think that was one of the main defining elements of the original series. Kishi wanted to show here is a character that no one likes because he has a living breathing monster inside of him. You can only wonder what he is thinking, being in his predicament. Watching him grow up as a monster and trying to be known as a famous shinobi and protect his friends, but realizing that he is in a world fraught with danger at every corner. Watching his friends die before him or getting hurt. The degree of emotion in the series was something I really enjoyed. It was really powerful. I remember hearing people spout nonsense in the discussions boards ""omg to much drama, get on with the fighting already"" But I actually liked how naruto had that drama, it fit in with the entire theme of the series. It kind of brings a whole different realism to the show compared to other shonen series. I won’t state any names. One of the things that kishi really focused on in the original was friendship, and bonds. Thats one of the major theme's watching this team 7 grow up together, learning from kakashi and becoming great ninja in the process, learning the ways of the ninja world. This show explores themes of revenge, hate, bonds and sorrow to a very astounding degree. The characters in this series were in every sense of the word children, growing up in a world full of adults that were much more talented ninja's both skills and combat. That is not to say the show was made for children. Just that kishi wanted to show the younger generation as the main characters of the show and the older generation as the training shinobi. They had to learn the ropes of what being a ninja is like. After their pre training sessions, they were finally put to the test of just how grueling the world is and how they must use every ounce of there being to survive and also protect the people they love. 10 years ago people viewed naruto very different to how people view it today. I still consider naruto to be one of my favorite quality anime series, regardless of where it’s going. Perhaps maybe its because im very infatuated with ninja's and like the unique way that kishi has created this ninja world. Similar to how i really love pirates in the one piece world. Every arc is something new and fresh so kishi can develop on that and expand upon the show in various different ways. One piece had some of the greatest character back stories and cast I’ve seen in a series, but it did suffer from story progression a bit thankfully naruto does not. It has a pretty solid pace and some of the most ground breaking plot twists. I guess it’s all a matter of personal preference and what you like to see in a show. I my self im not a huge fan of typical shonene tropes that are used consistently, but i love how the original series gave us a much more powerful emotional impact to the show. In away it felt more humanized as apposed to the more generic super power elements of shipuuden.",10,Recommended,"Dec 3, 2011",Naruto,Naruto,20,naruto_2e4e6db105,1
"I'm sure most, if not all, the people who end up reading this review have seen Naruto before and those who haven't are probably put off by the pure unadulterated hatred this and the more recent Shippuuden garner. Okay, I guess ""unadulterated"" is a strong word but I digress.. In any case, before starting this review I want to point out that I haven't read the manga so I'm unsure as to what was or wasn't changed during the process of animating this story and I guess it's time to get the show on the road. *Also, let it be known that the infamous ""Filler Arc"" is not part of this review. Naruto is the story of a group of rookie ninja from Konoha (Leaf) Village, with particular focus on our title character Naruto Uzumaki and his two friends Sakura Haruno and Sasuke Uchiha. The story starts soon after the three of them graduate from there Ninja Academy and are put under the care of Kakashi Hatake who, for the most part, takes on the standard role of the ""mentor"" who teaches them the value of teamwork and all that jazz. The main characters can apparently be hit or miss, though I liked them for the most part. Naruto himself seems to follow in the footsteps of Goku from the Dragon Ball franchise, though I personally don't consider him anywhere near as dense and also don't consider him an ""idiot"" like most people tend to. Sakura seems to get the most flack from my experience because, for the most part she plays the ""useless female"" role. The thing is, she herself realizes that and actively tries to change herself which makes for some interesting scenes down the road. Sasuke is probably the most intriguing of the main characters, simply because he himself admits that he is only training to ""kill a certain man"" and he and Naruto clash quite a few times over their belief systems, particularly in the oh so excellent final arc. As far as Kakashi, there isn't a whole lot to say as he reveals very few nuggets of information about himself. He's a cool guy, but he's very much a supporting character during this series. But, to be honest, the thing that Naruto can be proud of is the excellent cast of supporting characters. From the intelligent, yet lethargic Shikamaru to the Bruce Lee wanna be Rock Lee it's pretty cool to see all these different characters, who usually have a very interesting and unique fighting style, clash with one another. It also should be mentioned that a certain villain, Orochimaru, who appears rather frequently is a scene stealer and takes part in some of the more memorable moments of this series. It's also when he appears that the show really takes off and gets interesting, as he is the instigator of some of the biggest plot points. His personality and his willingness to use any and all means to further himself and his power is interesting and very often disturbing. One thing that is important throughout the series is the running theme of revenge and human relations. Every one, from Gaara to Sasuke to Naruto himself has had some sort of bad experience during their childhood and it seems as though ""friendship overcoming tragedy"" is maybe the predominate theme throughout the show. Now this series being a shounen, it's obvious it has pacing flaws here and there. For example, many of the fight scenes are dragged out to an annoying degree. And this is very apparent in the first arc when the characters go through two separate fight scenes that both take at the very least three or four episodes each, which isn't a huge problem if you marathon the series like I did. But, it still deserves mentioning as it is annoying. The plus side is that most fight scenes, particularly during the Chuunin Exam arc and beyond, are very well animated and just overall well done. The aforementioned Shikamaru for example has some of the more noteworthy scenes because he uses his head, instead of any physical abilities, and his fight scenes are always damn good fun. But, this also highlights one of the issues I do have with the fight scenes and, even though this is a problem with shounen action anime in general, it's especially bothersome here. The characters have a habit of explaining everything they do to their enemy which would be time better spent actually defeating your opponent rather than telling them your skills. I know it's just so the mangaka can flex his thought process and the logic behind the attacks to the viewer but..it's still kind of tiresome and could certainly be implemented better. I think the music bears mentioning as I thought it was either great, such as most of the music used during the dramatic scenes and some battle scenes, or forgettable, which is pretty much the rest of the fight scene music. The Japanese voice actors did a great job imo, especially during some of the more serious scenes. But, I especially got to shout out to the multiple voices for Orochimaru. Of which almost all of them are suitably creepy and, even though they sound different, they still manage to pull off the basic speech patterns. In Summary: Story: 7 It takes a while for things to really get going, but once it does you'll notice it. Unfortunately for some, the pacing can sometimes be broken by the short training arcs which are actually pretty entertaining and in many cases are segued in nicely with the story arcs. Also, there is only one short filler arc throughout the first 135 episodes. Art: 8 First off, it should be apparent from our protagonists conspicuous appearance that, in many ways these guys are ninjas in name only. Still, the appearances of the characters throughout the series are so varied that I, at the very least, didn't care. Animation does take a dip occasionally, however. Sound: 8 Orochimaru is a plus, no doubt about that. And most of the other cast members have good voice acting, though Rock Lee's can sometimes be grating.. The music is pretty good, though occasionally generic. Character: 8 Depending on how you take to Naruto, Sasuke, and Sakura this could be your favorite part of the series, which is the case for me, or your least favorite, and probably game breaking, aspect of the series as it does depend upon these three for the vast majority of the story . But, I'm sure most people will like the supporting characters as almost all of them are developed to a satisfying degree. Unfortunately, all of them fit the tragic past stereotype so...your mileage may vary. You may want to avoid this series if you aren't a fan of melodrama. Enjoyment: 9 Hell yeah, I enjoyed this series. I won't lie, I loved this series. But, it certainly isn't for everyone and I can understand quite a few people being frustrated by this shows some times slow, often times fast pacing and some of the more dragged out arcs even frustrated me at times. Also, as I said before, enjoyment largely hinges on whether or not you take to the three main characters or not. Overall: 8 To sum it up, don't go into Naruto expecting to see the tightest script ever written or anything thought provoking. Just go into it for a fun time and, maybe, you'll be surprised by the well developed characters like I was. Make no mistake, Naruto was a great experience for me..especially because I went into the series expecting it to be terrible and, by the time I realized it wasn't, I was enjoying the ride. *If you want to make any sort of comment, just drop by my profile. Criticism is welcome as this is my first review in quite a while and I went with a different style than I have in the past. Thanks for reading this review, I hope it helps anyone interested in this series.",8,Recommended,"Apr 30, 2011",Naruto,Naruto,20,naruto_46a1543fc7,1
"ok so I've seen like 200+ series and i have to say that this is one pathetic series. i watched up to shippuden 50. im telling you nothing interesting happens, and like 90% of the series is filler anyway. the plot is seriously lacking and its a pathetic excuse for a slice of life/action-drama type of show. im writing this for people who legitimately haven't seen the show but the series is just NOT worth the acclaim or watching at all. the characters are even worse. you have your over-zealous,untalented guy who thinks he can do anything if he tries hard enough. . .and he just so happens to get increasingly stronger enemies to fight along the way. than you have your emo broody guy who all the fan girls swoon over while he talks about how much he resents his brother and must AVENGE HIS CLAN! get over it already and last you have your naturally talented good girl who has a crush on the bad boy, even though its obvious he hates her and that the other guy would kill to have her. look people this has been done MILLIONS! of times before so please if you haven't seen the series don't watch it. it will waste days of your life away for nothing. . .literally the series will take up 88 hours of your life! thats over 3 and a half DAYS! you could have been doing something WAY more productive. hell, it doesn't even have to be productive. you could probably have a better time watching paint dry! listen to me people, for gods sake i only watched as far as i did out of obligation to finish a series i started but it wasn't worth it! so PLEASE heed my words and never ever watch this series of overrated garbage!",1,Not Recommended,"Dec 19, 2008",Naruto,Naruto,20,naruto_c521ad62f3,1
