review_text,user_score,recommendation,review_date,entity,series_component,series_id,review_id,page_number
"Believe in the Naruto that believes in you... that’s what Kamina said at least, right? Naruto is iconic. With all the Naruto-running, cropped pictures of Sasuke being choked, and the forgotten classic of “Tobi is a good boy” memes that have laced the Internet, this the Digital Age is not without its Naruto influence and perhaps even bigger to people today than what Dragon Ball was to the generation prior. I wouldn’t be surprised if at least 10% of all zoomers have seen some form of Naruto in their life too. It’s an anime that deserves to be experienced. If it wasn’t already apparent, I love Naruto. Naruto was one of the first anime I remember watching where I was aware what I was watching was just that. I would even credit the show for lifting my fascination for Japan and all things anime off the ground too. Going from staying up late with friends to catch the latest weekly episode on Toonami, to going to the Naruto website to catch the latest subbed episode, to reading the manga, and rewatching the show over and over again as the years went on. But over those years I’ve slowly become disillusioned with the it all; Naruto quickly became one of the more contentious shows I’ve groan to know. I have to say though, from the get go, what I appreciated about Naruto conceptually, ever since I first tuned into the show, was how it managed to subvert viewers through its premise. Knowing its creator, Masashi Kishimoto, originally had in mind to write his now highly-acclaimed, modern classic manga as a story that happened to revolve around shinobi arts as a vehicle to depict the value of friendship, it’s incredible in the amount of world building put into the it all, stringing together all sorts of East-Asian lore, mythology, and history to make up much of the inspiration. Instead of mercenaries set in a traditional, Edo-period Japan, we instead get a group of teenagers graduating from an academy to achieve their genin status depicted in a brand new ninja universe. All of that in mind, I’d go as far to say the world in Naruto is one of my favorites in any show. That brief mention about teenagers attending an academy? That’s only relevant for the first three episodes — arguably one. It’s funny how often I remember Naruto as a show about students attending a ninja academy when it’s not even near the core of the show itself. Instead we have students broken up into squads of four, consisting of three just-graduated genin and one jonin, the highest rank of shinobi, and it’s this dynamic we will be used to. Having the show revolve around a squad and not a room full of students at a school allows for more freedom in the story for our characters to move and a better chance for us to learn about the world through action. Like most shounen, action anime/manga, there is a power system in Naruto: chakra. Chakra is energy stored in all shinobi for which they utilize it through intense rigorous training and allows them to active various forms of jutsu. This power system, although better thought up compared to Dragon Ball, but one that’s not as well managed or balanced as Hunter X Hunter. More on that later. The different jutsu shinobi can learn and use include the three basics: ninjutsu, genjutsu, and taijutsu. There are also other, specific techniques like fuinjutsu which is a sealing style of jutsu meant to lock or unlock words, people, or chakra amongst other things into scrolls and paper tags. There are even techniques only specific individuals can utilize, being kekkei genkai. These are hidden techniques known only to specific clans or otherwise other passed down through their bloodline. One such example is doujutsu, an “eye” ability that, if they possess the correct eyes, can perform unimaginable abilities. Having chakra, as well as the focus, allows a shinobi to walk up walls and on water. There is a huge rabbit hole of information regarding the different shinobi arts and reading about it online is just as interesting as watching ten show itself, if not more. However, the gripe I have about this system is there isn’t any clear way distinctly knowing how much chakra someone has or how much is used up. Sometimes you’ll see characters fatigued or will straight up say they’ve used up all their chakra but you’ll find that any character can get around this through convenience or outside circumstance. No more chakra to use on your opponent? No problem, just run out of the way, perfectly throw a target, or have a neighboring ally save you from harm. If all else fails, just give it a little bit of time and you’ll suddenly regain enough chakra to use soon after. Jutsu get pretty ridiculous from time to time too. Although not nearly as bad as the power creep would get in Shippuden, moments where Kakashi and Zabuza, an incredibly skilled mercenary and Jonin that’s said to be just as powerful as Kakashi, are shown making hand signs, lasting around 10 seconds or so to do, in order to summon two giant dragons made from water out of a nearby lake, and that’s the only time you see a sequence as detailed as that. Every time characters do hand signs, time is not nearly as spent on the action and newly graduated Genin are able to do this while fighting off the enemy. Sure these are not just teenagers but ones that have gone through years of training to be able to do any of this, but it downplays the nature of battling with jutsus and sooner than later you find nearly every single fight is primarily a battle with magical powers. Again, thankfully this isn’t so much a problem in the OG Naruto show as it is in Shippuden, but the leniency of not having a tighter grip on the power system and the powers that come from it create too much risk for something out of control. Our main cast consists of Naruto, Sasuke, Sakura, and Kakashi, and for sake of brevity will focus more on than their importance’s to the show itself. The characters themselves, although not anywhere near the most original I’ve seen (especially for a shounen), share a strong distinction from the other, complementing each other’s strengths. The primary colors are often paired with green, for a fourth color like in the Opponent Process theory, and our main cast members all distinctly fit into each color (with a secondary color to boot), setting them apart easily when together and allowing room for their personalities to shine more. Naruto has both yellow and orange to emphasize hope, energy, and a bright future. Sasuke has a deep blue and black to contrast Naruto especially as well as show his dark and dejected past. Sakura having red and pink to represent the passion and love she bears. And Kakashi in a green and white which tells us how calm and focused he is towards his life and his students. It’s a simple yet effective way of storytelling, further preparing us for who shares the screen. The side characters to any show are only as strong as their mains and thankfully this show has plenty of good ones. There are several other squads that graduated from the same academy Naruto came from and each have their own distinct personalities as a squad. Unfortunately, every character outside of the main four have muted color schemes but up close you’ll notice their cool individual designs. Each character has an unmistakable style or “gimmick” to them and it makes for interesting scenarios for when they’re on the battlefield. Growing up and entering middle school around the time I was first watching Naruto, I fell in love with most of the characters found. I was enamored with their dynamics and interaction both in and outside a fight. It was like having a awkward, fogged up view of what being a teenager could be like... only without the ninja stuff. What’s unfortunate is those characters I loved would only appear for a certain number of episodes and then later, when that arc would end, would never be seen again until the next arc, if that (sorry Ten-Ten fans). As hopeful as one could be, not every side character is given the same treatment as another. Some are treated like temporary main characters, others barely have any lines. It’s as if Kishimoto doesn’t know what to do with them aside from being window dressing, with more screen time given to some in some of the ops and eds rather than the actual episodes (again, sorry Ten-Ten fans). Something Naruto does well though is how they handle their arcs. They are recognizable from each other and last for a long while, so unfortunately if an arc doesn’t excite you, it can come off like a drag sitting through it. Naruto, for better or worse, has two really great arcs, The Chunin Exam arc and The Retrieval arc. Every arc Kishimoto creates can be split into sections, which make for an exceptional way of handling them, but the two in reference are well beloved by fans for good reason, as they do an exceptional job in its overall content and refreshing narratives compared to some other long-running shows. I’ll admit that getting through some arcs feel a little “meh” than others, but I’d argue they at least hold a lot of significance and maintain an identity all in itself and the progress you see Naruto and co. go through. All in all, it’s a net positive in the arc department. Now, I gotta focus on the negatives, because if there is something I think Naruto doesn’t get enough flack for is its pacing. Naruto has filler, an ass load of it, but even during canonical episodes you will witness poor pacing that cuts the seams in the production schedule. Showing anyone this show, at this day of age, can be cringe inducing. Having to sit their with your significant other as you watch all the characters stand around for nearly a minute as the scene pans around, closes in on everyone’s reactions, and zooms in on a single still shout of the “action” itself. Hearing a chuckle accidentally release from a confused viewer, I am reminded we are watching mediocrity and not something with proper heart and creativity put in. If the show isn’t randomly inserting filler in the middle of an arc, then it is bogging down the episode by stretching out its moments, contributing to the horrid pacing. Not every episode is like this and several fights in here I’d argue are among some of the best fights in anime ever, but that’s only a fraction of what makes up the bulk of this show. I mentioned it before, but Naruto is plagued with its filler content. If you’re wanting to pick this show up, just know it is quite the undertaking. I already mentioned one of the shows to precede Naruto, being Shippuden, but the other is Boruto, which is a spin-off taking place after the events of Shippuden, so to get the complete Naruto animated experience you not only will have to complete 220 episodes from here, 500 episodes of Shippuden, maybe the 11 films sprinkled here and there, and the currently airing Boruto: the Next Generation which is sitting at 185+ episodes as of this writing. I’d honestly pit a good argument that it’s more of a journey getting through all the show than our titular character has ever experienced. So, how much filler are we talking here? Well, firstly, I will admit that I too, sometimes, will not give my full attention to a show for every single moment it graces my screen. This is mostly due to the lack of time I have to enjoy to myself outside of when I’m working and would rather indulge in multiple outlets. So the idea of someone not committing to giving their full attention to the filler in Naruto is understandable, but it’s still questionable. If you consider the 720 episodes of Naruto and Shippuden combined, there are 425 episodes that are canon to the manga. That’s 59.03% that is actually related to the story being driven. Just slightly over half of the animated television material is worth consideration of being absolutely crucial in the eyes of many fans. Something that’s far more common than I expected for new fans of the show to do is follow a PDF, usually one found somewhere online, that list the different episodes dedicated to being filler, and skip those episodes. And that’s the problem. If a show has way too much filler that you’re willing to skip, perhaps that says a lot about the product itself or maybe the viewers that skip it all without question are hesitant to admit the show’s shortcomings. Perhaps that overall rating isn’t deserved? Hmm.. I’m actually a fan of filler. For the most part I’ve never really minded it before or after knowing whenever I’ve watched any too. Naruto, for a majority of the time, has some good filler. There is some bad filler, in fact, literally the second episode in the series is a filler episode. That episode is a bad and annoying episode, and while we are at it, if you’re about skipping episodes, you can probably just skip the first two episodes as the third episode makes for an amazing pilot episode and is one of my absolute favorites in the series, but that’s neither here nor there. Many that have watched the filler with agree that the episode involving Naruto, Sakura, and Sasuke trying to see what’s under Kakashi’s mask is an example of good filler. Although I personally don’t care for it, as it’s a bit too slapstick and tonally separate from much of the show, it’s at least a bit of proof that there is value in watching them. The Land of Tea and Land of Rice Patties arcs are two of my favorite sets of filler episodes that I think every fan should watch. Of course, many will still skip the filler as it’s a matter of principle and finishing the show as quickly as they can without being bogged down by events that are inconsequential regardless of the entertainment value. The art is both and hit and a miss. For the time it looked pretty good, but nothing stellar. Watching it now I’m able to notice more of the shortcuts the animators made when producing the show. Kishimoto has even expressed concern over his drawing abilities over time when illustrating. The show does have its fair share of sakuga, particularly in certain high stakes moments in anticipated fight scenes. But if there is one thing every Naruto fan CAN agree with it’s that Naruto has some of the best collection of ops and eds on the market. To me, Naruto felt like it was always trying to one up itself and change its theme music to not just keep us in tune for when a new arc/section of the show begins and ends, but just because it could. Naruto had the clout to justify its seemingly rapid output of ops and eds and each one sticks with you in some way. You could probably learn a lot about a person judging solely on which Naruto op and ed they favorite the most. Looking into everything, I’ll admit this show can be a fun ride and not even me at my most cynical, not even me after binging Neon Genesis followed by Angel’s Egg, not even me with a partner at my side could intellectually tear this Show down by saying it’s not fun. Because Naruto can be fun to watch. It’s a show you can easily get lost in. I didn’t want to focus on any spoilers but there’s plenty to nitpick there, but I can still understand why someone could like the show regardless. As essential this show is to experience, at this point in my life, if pacing/filler is an issue for you I cannot in good conscience recommend someone sit through at this show. Again, I believe it’s essential but you’d be better off lurking online for information regarding the show rather than be disappointed trying to commit to the entire thing. If you decide to check it out and watch a few episodes , I think you’ll know right away if you’re going to like this show and want to stick with it in the long run. I may have a hard time liking Naruto, but I still love it.",7,Recommended,"Mar 16, 2021",Naruto,Naruto,20,naruto_597cad7a0c,8
"I suppose why Naruto is so popular and can be welcomed for ages, the main reason is Naruto just like a funny booktext, every one reads it with fun and remembers the context and charaters. when we grow up the idea of be one of the character in Naruto just come out. and Naruto is still there.",7,Recommended,"Sep 20, 2012",Naruto,Naruto,20,naruto_33b6ba5bbc,8
"I only recently got into anime, and so had the benefit of doing some research before watching the first series of Naruto. I was able to skip all of the filler episodes, and believe me, nearly 50% of the anime is filler. So, even though I said above that I've seen all 220 episodes, I've really only watched the canon episodes and a few of the recommended fillers. Even so, Naruto was one of those shows that needed to grow on me. Having previously watched Hunter x Hunter, it took me until after the Ninja Test arc to really get into it because so much of it reminded me of Hunter x Hunter. Nevertheless, once the two ""test"" arcs parted ways I felt Naruto better eased into its own thing. I have the character mark an 8 because when I began the show I only saw Naruto as a whiny brat, but by the end his character really grew on me. Pacing might be a bit slow for some, but I'm one of those people who enjoy back stories and getting to know characters better. For this reason I still have a few filler ""arcs"" that I've heard were good and might want to go back and watch. In the end, I thought the series was highly enjoyable to watch. I originally was hesitant to only watch the canon episodes, but having done so I'm glad I did. There are a number of websites that list these. Since the show is up in part on Netflix and other streaming avenues, I would also recommend finding the wiki on how the episodes divide into arcs. This helped me get a sense of direction when watching.",8,Recommended,"May 21, 2016",Naruto,Naruto,20,naruto_7e4eeb2977,8
"EPIC ANIME! HATERS CAN KEEP SHUT!! Anime is filled everything you need i really love naruto because he is an average like everyone and achieved things through hardwork and fights of this is not compareable to other anime because naruto's fights are on different level.Story is amazing and there are moments that will make you feel sad..And Characthers like kakashi,Itachi and many more will stand out throughout history...This anime is Real nice just skip the fillers and Its one of the best anime out there!! HATERS WILL KEEP ON HATING BUT THIS ANIME IS EPIC YOU CAN't CHANGE THAT!!! So this anime recommend to those who love anime this is a must wacth anime for them!!",10,Recommended,"Jan 7, 2016",Naruto,Naruto,20,naruto_849b5f2190,8
"Like is the case for many people, Naruto was one of the first anime that I watched. And like a lot of people who hadn't seen much to compare it with, I loved it! But I grew up with Naruto and as time passed, I did find plenty wrong with it. Now it's a show that I like to make fun of out of love, like an old friend. So with that disclaimer out of the way, let's get to my actual thoughts on it. Naruto is seen as one of the most overrated series of all time because to any seasoned anime viewer, it IS average. The artwork can seem subpar, the shear number of filler episodes is terrifying, and certain dub voices can make you cringe. However, there are a few qualities that do make the series special. Not all of the music is great, but there are a few songs that you can't help but be moved by. And with the dozens of songs, you'll never get bored of hearing the same thing. Secondly, there's a great balance between plot, action, and fun time (granted, the humor isn't great, but hey, there's still action and drama, right?). And once you finish wading through the sea of filler, there are the moments that make it all worth it. But sometimes it does feel like work to get to those points, so if you're the type who would prefer an anime that doesn't hold back and jumps straight into an intense storyline, Naruto isn't for you. But if you enjoy a good long show that slowly develops lovable characters, is in no particular hurry to get where it's going (but it will get there), or just want to see an old classic, Naruto might be perfect for you. Personally, I may have to watch it again soon myself. After all, this show really did change my childhood and probably made me a better person. I hope it can do the same for everyone else.",8,Recommended,"Mar 18, 2016",Naruto,Naruto,20,naruto_89be956af7,8
"Everyone makes Naruto out to be the most beginner anime out there; you can't watch anything until you've finished Naruto. While it is an older anime, and it isn't a bad anime, there are many things about Naruto that can be hard to follow, lame, or just cliche. Naruto comes along to be one of the greatest anime in existence - but I have to disagree. Like many of us here, we can agree that Naruto is a good anime... but it is a far cry from masterpiece. I have not finished all of Naruto, but I have watched most of it. I have an idea on how the rest of the anime will run. Story (6) For those of you who read the summary, this anime is about a young male, Naruto Uzumaki, who wants to surpass the Hokage, or leader of the Leaf Village, through training and hard work as a Shinobi (ninja). It was one of things that had originally drew me into this anime. It seemed incredibly original, and it actually is. Many well-detailed plot twists, interesting plot at times, and moments of triumph reign this anime supreme. But that's only a small part of the anime outside of the filler episodes that go through it. The original story of Naruto does sound very nice... it's about Naruto who wants to be Hokage. But the anime dwells further and further away from Naruto's dream that it starts showing up less in the main episodes and starts making a new home inside of the filler episodes, where you can watch literal hours of Naruto trying to learn something, fail, and then do something ""spectacular"" or ""creative"" to master a technique. I kid you not, it's one of the most boring things to watch in an anime... ever. As I mentioned before, the plot about Naruto begins to fade and shed new light on anime all-time favorite character Sasuke Uchiha, the last of the Uchiha clan, who survived a massacre not too long before the events of the anime, and when he wants revenge on a certain man. This is a great side-plot, but the thing that bugs me the most is that many episodes focus on Sasuke's dark desire to bring his family the justice they deserve. I believe several people already pointed it out in other reviews... You being watching many filler Naruto scenes, and many plot-ridden Sasuke scenes. Like I said, for the most part, story's really nice. But the amount of filler and add-ons were enough to make four different Naruto mini-series called Sasuke, Naruto Training, Goofy Garbage, and Boring Garbage. Art (8) Graphics are at the best an 8. The character designs were key in my approval of the art style, but the animation flunked some times and characters could be unrecognizable in combat unless they were the focus of the camera. The art style, in my opinion, while old - looks very clean and nice, and I find it to be very creative and appealing to look at, even if it lacks detail in far-ranged shots. Again, character design was cool. Kakashi looks wonderful and like a true ninja and the members of the Akatsuki are pretty unique. Sound (8) Some music is good, other parts, not good. The opening songs in Naruto are very annoying and forgettable, as I found myself reaching for my remote to skip ahead of it and try not the die from ear blood loss. I don't know how others feel about the openings, but personally, I find all of them to be very horrible. Sound effects used are comical and had me laughing a lot at times. Naruto's blissful stress and irritation can be seen entirely through the noise each character makes when they are in such states of distaste. Especially Sasuke. Snotty little boy. Character (9) Characters are my favorite things in Naruto. While they can be repetitive and lack originality, which is why I give this section a 9 over a 10, most of the people in this are very interesting and make memorable moments through-out the anime, even Rock Lee, who had me scared at night thinking about that bowl cut and perfectly round eyes. Most characters have their flaws and evil sides, which is what makes for a truly interesting character, even Naruto, who has the spirit of the Nine-Tailed Demon Fox inside of him, an aspect that makes the Hidden Leaf Village have large urges against him. Enjoyment (7) Story is good, lots of humor added in there, enjoyable characters, and generally interesting action sequences are what make this have a higher rating. However, even with the pros listed above, Naruto has many moments of filler episodes, fights that last for 10+ episodes, and events that happen in the fillers that had me pulling my teeth out. I get that it's not necessary to watch filler episodes, but it still exists. Very hard to enjoy watching repetitive things happen during the course of Naruto's training, especially when he is with Pervy Sage (Jiraiya). So I give this a 7. Overall (7) To round this off, Naruto isn't a bad anime. It's definitely one someone should hit if they haven't already, but don't expect your socks to be flying off during the events of what happen in this anime. This anime is good - but it isn't as great as everyone makes it out to be. If you have the time to be sitting through 200+ episodes, go ahead and watch this, and be sure to skip the filler episodes unless you want to be bald from tearing your hair out.",7,Recommended,"Mar 3, 2017",Naruto,Naruto,20,naruto_a4cbbd856e,8
