review_text,user_score,recommendation,review_date,entity,series_component,series_id,review_id,page_number
"If you have a friend, or better yet a group of em', always criticising your anime indulging existence. Fret not, convert them. Throw this at their faces and if all goes well (it did, for me) theyll be begging you for more. A boy that is destined to be hated for life, alone and sad forever. Naruto shows that no matter what kind of society that you in and no matter what is thrown against you, you are the key that makes it better for yourself. Written down in a world where ninjas and inner spirit power (Chakra) takes place, it opens up a new way of how we or should i say, i, look at ninjas. Forbidden techniques, country-colonizing, 3 man teams. You wont know what ninjas really do after you watch this. Sadly, to me it kind of lost a great deal of fans. A year long series-killer, fillers. Yes. It started off to be quite entertaining but before long, the episodes were like aired as though it was just to keep it going while the manga side runs on. Then, life breathes back into the series it when it was announced that the original manga published stories were set to be aired as a second part of naruto with a timeskip, featuring a grown up naruto's generation and apparently new quality of episodes. Check for Naruto: Shippuuden.",9,Recommended,"Oct 24, 2008",Naruto,Naruto,20,naruto_0d74a62a97,4
"For some reason loads of people like this anime, I really do not get that. I watched the show until a certain villain (do not want to spoil it for others, just because I am civil) died, because the villain was the most interesting character. I mean: Naruto. Uninteresting character with the""a super powerful creature is inside you"" cliche (seen it in yu yu hakusho, bleach ans a ton of other shows). What does he want to be? A ninja... That is the begin motivation and then I wonder ""how do I connect to this character?"". Then the failed attempts to make him funny make him annoying, his power is not that interesting and then I did some research and it will only become worse. Sakura. What is there to say about her? did she do anything in the first 2 seasons? well... she jumped before an old man to protect him with a kunai... and failed to do so. And that is all my faulty memory remembers about her. Sasuke. Somehow he is the beef cake bad boy personage, that got girls in real life swooning over him, I really do not get you people... He is bland and monotone, but hey at least he does things! Fights. Nothing that we have not seen being done better in older anime (yu yu hakusho for example, hell even dragonball and flame of recca were better in fight scenes). Big weapons are being used (what use is a shurken if it is foldable and has a diameter of one meter?) mostly and when they use their kunai their utterly useless. Then they use their ninja magic to fight, sasuke mostly breathes fire, naruto copies himself and sakura does nothing. No real tension in this anime from what I have seen and does not really motivates me to look further (and I watched some horrible anime, willingly (though they're not on my list because they are quite obscure and I forgot their names...)). Premise. Ninja ninja ninja ninja, ninja ninja, believe it! Even though they are not ninja's since they do not use any stealth, I can forgive them calling themselves ninja's, the problem is that they keep putting attention to it! WE GET IT YOU ARE A NINJA AND NO I WILL NOT BELIEVE IT! STOP SAYING THAT! And Naruto has some kind of 9 tailed rabbit thing that says it is a fox sealed inside him for a reason and there are people with very unusual weapons that would not be that good in our world, but hey suspension of disbelieve, eh? Overall. Not a pleasant anime and I find it a wonder that the show lasted this long in manga form...",4,Not Recommended,"Jun 18, 2015",Naruto,Naruto,20,naruto_1b1e845cab,4
"-The fans are waiting for the plot to continue, we need to delay it. We will need fillers, lots of fillers. -Hundrends of fillers... -But my lord, there is no such force... ""doors open to reveal a sea of fillers"" -This night... You will feast on the patience of fans!!!! ""But Bleach had a lot of fillers! And you gave it a perfect 10!!! You hypocrite!"" Yes, but Bleach had filler ARCS! Consistent, well directed, logically lengthed, ARCS! And gradually improving ones too. The Nozomi Arc (the last one) was in fact as good as the main story if not better. Naruto on the other hand has one-shot episodes. AWFULLY written, one-episode fillers that add nothing to the story and are in fact a real pain to watch. Also, Bleach didn't interrupt the main story more than the number of Filler Arcs. Naruto on the other hand usually throws one main story episode and follows it with a filler one. This is unbelievably annoying, as you feel the story keeps getting interrupted by fillers. CONSTANTLY. Main story episodes concerned, Naruto offers amazing battles (especially the exam episodes at the start of the series were AWESOME) that leave you really impressed. The rules of combat are well explained (moves cannot be repeated indefinitely, every skill has a weakness, people get tired, etc etc) and the music makes the fights all the better (keep in mind that the length of the fights is pretty good). Character designs are also very distinctive, so that, like bleach, you will remember almost everyone (and unlike One Piece I might add). A problem that appears halfway through the anime and starts appearing waaaayyy too often later on, is the obsession of the mangaka with ""history repeating itself"". The first time this became evident it was quite cool, as you didn't expect such a good ideology from the script. The second time you still liked it but a bit less. The third time you just patiently waited for the anime to get over with it. AFTER 100 TIMES IT'S REALLY STARTING TO PISS ME OFF. Every team in existance is composed of 2 men and one woman. One of the men is quite serious and cool, the other is a fool that constantly draws attention to himself by acting stupid, but is in truth the big-hearted one. EVERY, F$%KING, TEAM. Calling the plot ""repetitive"" would be the understatement of the year. Another thing that quickly becomes annoying, especially in Shippuden, is how the show constantly throws at us that Naruto had a rough, unfair childhood. Again, the first time it was a very welcome addition to the anime, showing how far Naruto has come to be respected by his peers. But when it's done in every single episode you really start hating it. No more flashbacks please! I don't care how much money you save with the animators! Get on with the plot! If the above weren't enough out of the three main characters (Naruto, Sasuke and Sakura) Naruto is a complete idiot, Sasuke can't decide between being emo, an avenger or Itachi's little brother and Sakura keeps pursuing the same guy for about... The whole anime + Shippuden. Not the most inspiring of leads to be sure. In fact if it wasn't for the awesome battle music I'm pretty sure Naruto would be hated by everyone. (Oh and for the record: I absolutely hate Jiraya as a character, there I said it!) Find an episodes list that doesn't include the fillers and go watch it, for the battles alone it is totally worth it.",7,Recommended,"Nov 2, 2014",Naruto,Naruto,20,naruto_8b3e3373af,4
"Erm. Yes, I'm advocating for the positive side of Naruto... Just don't shoot the messenger :P Currently, there are 26 reviews written for Naruto, out of which roughly more than half advocate that Naruto sucks, is not worth watching, and is simply overrated. Right. So we know that the fillers are horrible, the plot's &quot;typically shounen&quot; and Sakura never does a single thing. But why exactly has Naruto become so popular? What makes it tick? What keeps reeling in the dough for Kishimoto? There are a variety of reasons. Naruto is the very embodiment of the shounen psyche. It deals with some common fundamental themes that appeal to the audience. Valuing your friends, never giving up, and challenging the status quo are just a couple messages conveyed by Naruto's plight. And we, the viewers, can relate to those themes. Supposedly. Then of course, are the insane battle scenes. True, some battles are incapable of suspending disbelief, as you think &quot;that's doesn't make sense.&quot; Then there are the parts where someone has to explain every move he makes. However, overall, the animation, the music, and the &quot;situation&quot; all add up into something that excites and awakens the ninja within us. (Wow, that was corny) There's also a fair bit of humor involved. Most of it is slapstick comedy, such as the teasing born from the Naruto-Sasuke rivalry, while other comic scenes truly manage to touch the humerus (episode 101, anyone?). However, some of the older viewers are nonplussed by many scenes which simply come across as stupid and juvenile. Though i'm sure Kishimoto knew crass humor is a double edged sword at times. Finally, Naruto is often geared towards younger viewers. Yes, those little midgets everyone ignores on internet forums and discussion boards (lovingly referred to as &quot;Narutards&quot;) are probably the greatest reason why Naruto has gained such popularity. This review was hastily manufactured at 3:12am. Please excuse any lapses in grammar, spelling, and sanity I may have had in writing this review.",7,Recommended,"Jun 18, 2008",Naruto,Naruto,20,naruto_c10a0d4101,4
"So. Naruto is a great show. I think a lot of people get too comfortable being so critical of this show when they forget this series debuted in 2002, over twenty years ago. Look at the other shows from this year, none of their names are particularly famous. So now when people watch this show with the expectation that it is the best thing out there, (when they became anime fans later on and watched a plethora of other shows beforehand) they forget that this show is a product of its time. When I watched Naruto, there was the ""big three of Shonen"" One Piece, Naruto, and Bleach (Dragon Ball, Evangelion, Inuyasha and Yu Yu Hakusho were a bit earlier). It's hard to speak about Naruto and ignore the impact the show had on the anime industry as a whole. Naruto brought a lot of international anime fans, and there's a reason; not only are the story and characters compelling but the animation is good. I won't lie, there is a lot of ""filler,"" but if you look at the bigger picture the filler adds important characterization to the story. Naruto is one of my favorite shows, so much so that I wrote about it in my diary when I was younger. The soundtrack also SLAPS. Since this review is only for the original and not for Shippuden, I will give it a higher score. While yes, Shippuden shares qualities with the original, there were some misses in its execution. ANYWAYS, I think critique is good, but people need to realize this is a 20+ year-old show, from a different time, when there were fewer international anime fans, and when anime wasn't as mass-produced as it is now. I digress.",8,Recommended,"Nov 9, 2024",Naruto,Naruto,20,naruto_372c289889,4
"Warning: Might be spoilers, not like &quot;oh naruto kills 'name', but like &quot;at this time it was sad&quot;. Well, first off, yeah this was the first Anime I saw, hence I loved it, but that ended quite horridly some episodes after episode 80, when it started falling, and I mean FALLING from grace, it fell so hard I nearly cried. It started out as a great anime but turned out to be some repetitive piece of crap.(Spoiler) I must say that no anime has had me as close to crying as this one from the things that happened around the Zabuza time(Spoiler). So my advice is to only watch up to about 80. (Only for those who have seen it all) : What pissed me the most of is when they repeat the EXACT thing that happened around the Zabuza time with that other 'sword dude' who has two swords instead of the gigantic Zabuza one. Everything is the same, just with different skills and abilities.",1,Not Recommended,"Jul 21, 2008",Naruto,Naruto,20,naruto_e12240c587,4
"*While sorting out video games* Ak: Hm...? Hey! I found a PS2 game in here! NK: Thanks, Akyn. That needs to be over here. Ak: I didn't know you used to like Naruto! NK: You found Ultimate Ninja, didn't you? Ak: Yep! Hey, why'd you stop watching Naruto, anyway? NK: Well, I was reading the manga at the same time, and I got tired of all the filler episodes. Of course, I didn't read all of it, either. Stopped shortly after the Shippuden switch. Ak: Oh...why'd you start watching it? NK: Because it had ninja in it. Why wouldn't I start watching it? Ak: Do you watch everything with ninjas in it? NK: Not much anymore. I used to be obsessed with ninja, though. Ak: So, do you like Naruto? NK: Still? A little bit. It had some funny moments, and some of the characters weren't half bad. Ak: Like who? NK: Hinata and Kiba were a couple of my favorites when I watched it, and I still like Kakashi. Ak: How come? NK: He's such a serious leader in tight spots, but he has a good sense of humor, as well. Ak: Even though there was a lotta filler, did you still like the story? NK: Yeah, it was pretty interesting. Ak: Any part you liked best? NK: The Chuunin Exam was my favorite arc, especially the individual fights. Those were really well animated. Ak: Any scene in particular? NK: Hmm...my favorite scene was actually before the Chuunin Exam. It was the Water Dragon Jutsu clash between Kakashi and Zabuza. I used to have the hand seals memorized for that. Ak: Wow! NK: Just wasted time, really. Ak: So, you're not gonna watch the rest? NK: Nope. The story got really complicated even without the filler, plus there's only so much bad voice acting one can take. Ak: You think others should watch it? NK: It's a good beginner anime that covers all different types of characters, so those who don't know much about anime could start with Naruto. I wouldn't recommend watching the entire series, though. Ak: 'Kay! NK: All right, next drawer.",7,Recommended,"Jun 8, 2010",Naruto,Naruto,20,naruto_7d24fcf416,4
"Listen listen listen. You need to know that I'm reviewing this based on the canon parts of Naruto. The reason it's probably rated so low on average on MAL is because of the amount of filler that's in it. If I was taking all that into account, I'd probably more likely rate this series an 8 instead of a 10. However, since I'm not going to do that, please let me tell you why Naruto is one of the best anime to be made. The story in its barest form isn't all that original, right? It's typical Shounen, so I can't really vouch for the astounding, original plot. However, I can and will brag on the story that was told through this anime. Before I do that, though, I will point out that the pacing of the plot does sort of ignore unnecessary things. It may feel to you that's it's moving a bit swiftly because there isn't a whole lot of buffer between arcs, and the arcs don't waste any time getting to their main point. That being said, I absolutely love this coming-of-age story. I think it translates loneliness and childhood really nicely into a fantastical universe. Though, as I said, the pacing is a bit fast, the story itself blends really well to the point where you can't really tell the difference between where one arc ends and another begins. I can't brag on the details of the story too much because I don't want to give it away, but it makes you feel empowered, and though the bare plot isn't original at all, the way its told has multitudes of personality. On to the characters. I always say that great characters are necessary for a story to be good, and in fact, they can even carry a terrible story if they need to. Naruto has a brilliant story, but its characters are what make it so beautiful. For one thing, this anime isn't afraid to make every moment an important one for a specific character, and I like that because it means that we get to see these characters grow up and change in a realistic way. Also, the friendships that are created through the story really make it worth watching, if nothing else. The strong bonds that are formed are portrayed really well, and I think they're used well also. What I mean by that is these characters are written in such a way that they each affect each other at every point in the story. It's a cool way to depict friendship. I'm very bad at reviews, but let me leave you with this at least: watch this anime. If you need to skip the fillers to enjoy it, do it, but the main story is so worth it. The voice actors are amazing, it's brilliantly funny, and it'll touch your heart in a way nothing else has. It's a classic for a reason, I really don't think you'll find anything quite like this anywhere else. And, if nothing else, I hear the sequel series is way better, so you may as well watch this and then have a good time with that. I'm sure going to. Thanks for reading!",10,Recommended,"Apr 9, 2019",Naruto,Naruto,20,naruto_1bbf27fffe,4
"Well, you've got to admit Naruto is one of the most popular anime in the world, also because it's also aired in the US. However, popularity does not represent everything. Naruto, definitely was very ideal and imaginative with these super ninjas. The three main characters, Naruto, Sasuke, and Sakura, all had a close relationship for they have been in a team for most of their time. Naruto and Sasuke, who were supposedly natural rivals, fought their best to compete each other and tease about the others' loss. By the time this arch enemy Orochimaru comes, this anime changes its environment. For the whole entire time, Sasuke leaves with Orochimaru, and therefore Naruto and Sakura tries their best to regain their lost friend. They all realize missing a friend could be fairly drastic towards everyday life. They tend to become stronger and fight with devilish opponents to move on and retrieve Sasuke. However, on the other hand, Sasuke refuses and once tried to kill Naruto because he had another objective in mind. Then, what kind of anime is this? Naruto and Sakura wants Sasuke back; they need him to be happy and believe that would do best for him. On the other hand, Sasuke refuses and fights back because he doesn't feel happiness in between their friendship. He wants to kill his brother who destroyed his clan. In the future, &quot;if&quot; Naruto ever caught Sasuke, what would they even do? Put him in a cage and lock him so that he won't escape? That's totally ironic! They want him back, but they know he's become all crazy, so they don't know what to do, but to seriously injure him so that he won't go back to his evil scheme. Is that even true friendship? The music is definitely great, for it gives different types of ideas. The music provides the thought of living in a peaceful village and swaying through history. One certain types of music from Naruto, it gives the idea of exciting actions full of thrill. The sound produced in Naruto is indubitably original and unique. The part where I enjoyed Naruto the most would be the beginning, where all of the story tends to make sense. Yet, in the later episodes, the author seems to push on forcefully to draw random frustrating plots.",5,Mixed Feelings,"Jul 22, 2008",Naruto,Naruto,20,naruto_332586ab77,4
"I first watched Naruto as a teenager, around when it was released, and thought it was dumb and dull. Now nearly 20 years later, as a 34 year-old, I decided to revisit it...and am more confused by its popularity than ever. Shounen series had been around for a long time when Naruto was adapted into an anime in the early 2000s. Weekly Shonen Jump began publishing in 1968 and big hits like ""Ashita no Joe"" and ""Tiger Mask"" followed soon after. Monster 80's hits like ""Hokuto no Ken"" and ""Dragonball"" would define anime for the decade and spawned a slew of imitators. Now, shounen is a formulaic genre (main character becomes stronger to defeat increasingly menacing foes), but that doesn't mean one can't do interesting things with it, or create very good, even great series. What strikes me the most about Naruto is how shabby and uninspired it is. In terms of plot, characters, and even the art, it resembles a forgettable early 90's shounen that poorly and lazily tries to copy more successful properties. To begin with, the art is basic and undetailed, and looks shockingly bad for an anime made after 2000. Faces lack distinguishing features aside from hair and eyes, and even the bodies are often interachangeable. It gets even worse with any action sequence, a central aspect to any shounen. The movement of the characters is all wrong, resembling that of an ungainly trash bag rather than actual human motion. One way the animators try to make up for this shortcoming is reducing the number of frames used, but that makes it even worse. Oftentimes, we see nothing between a character staring at an opponent and then suddenly hitting them. All the wind-up and movement in-between is ignored. For a series set in a secretive ninja world, it's surprisingly small and drab. There are very few characters that truly matter, and we meet most of them at the beginning. Naruto, Sasuke, Sakura, and Hinata, who we encounter in a dingy classroom in the first episode, are the four main characters, and shape the ninja world as much as anyone. The Third Hokage, the most powerful ruler, is also met in Episode 1, and presented as no one special, just an old man administrator. Rather than a rich, expansive world with mysteries and an abundance of unique, competing groups and ninjas, Naruto feels meager and limited. It doesn't help that the villains are largely forgettable, too. Shounen heroes take a variety of forms. Some are more reserved and stoic, while others are passionate firebrands. However, all the successful ones have one trait in common. They're cool. Whether it's the silent badass or the manic underdog who refuses to give up, these are heroes young male viewers respect and want to be like. By contrast, Naruto Uzumaki is lame. He is loud and annoying. He doesn't take his ninja studies seriously, or ever demonstrate a consistent dedication to becoming stronger or better. And yet, through a deus ex machina, at a critical moment in a fight he says something menacing and threatening, which sounds laughable coming from this clown, and quickly wins. There's nothing cool here. His victories feel undeserved and he reminds me of the loser spastics back in school that no one liked, not anyone worthy or aspirational. Lastly, the writing is lazy, riddled with plot holes, and disrespects its own world. Take the very first episode, for instance. The Third Hokage is able to see Naruto through a crystal ball. Why then are the ninjas he deployed to find him unable to do so until Naruto triumphantly returns many hours later? Did the Hokage not communicate with his retainers? Do ninjas have no form of communication, and were none of the ninjas left behind at the village to protect it or receive further orders? The actual answer is much simpler. Interference would have spoiled the scene of Naruto defeating a treacherous adult ninja, and the writers hoped the viewers wouldn't think too hard. But there is a much worse scene in the first episode. At the beginning, using a Clone jutsu for a school exam, Naruto is only able to summon one copy of himself, and a useless one at that. Later, at the climax of his fight against the treacherous ninja, he summons countless dozens of clones, all capable of effective combat. What changed? This sensational improvement occurred in less than a day with just a little more practice on Naruto's part. In other words, we're meant to believe he was a miserable failure after presumably months or years of training, yet is a spectacular success after less than a day. Incoherence aside, if a jutsu can be mastered so thoroughly with less than a day's effort, then jutsus are simple and unimpressive. After all, would you respect anything, like Tic-Tac-Toe, that could be mastered in less than a day? Notice that even a flawed series like Dragonball treated martial arts with far more reverence. Fighters would make great strides only after training for weeks, months, or years. And this was usually not any normal training, but under the guidance of a legendary figure (Master Roshi, the Kais, etc.), frequently in a unique environment, like the Hypberbolic Time Chamber. In this way, the series conveyed the difficulty and magnitude of attaining a higher power level or learning a technique. In Naruto, however, all it takes is less than a day's practice, so we must conclude that this is all child's play. (And given that these powerful ninjas beating up adults are in fact children, it is!) Of course, there are further plot holes here, as Naruto spawning 100+ copies of himself should easily defeat countless future enemies, but he conveniently doesn't always use it. Or waits to do so. Thus, we see that in every regard, Naruto is a very lousy, uninspired example of the shounen genre. The real mystery is how it ever became financially successful. I might not necessarily like other megapopular shounen, but in every other case, I can understand their popularity and acknowledge that it had either good or unique qualities. Naruto, meanwhile, flat-out sucks.",3,Not Recommended,"Aug 5, 2021",Naruto,Naruto,20,naruto_b95c6fadd1,4
Im not gonna tell you to watch this anime but let me just say Naruto one of the three OUTSTANDINGS The Three outstandings are Naruto Bleach One Piece Naruto is my favorite of the three because of Naruto himself his attitude and the cool Nine Tail fox moments make me get all hyped up saying bye bye enemy ninja ur screwed! naruto is the best anime i have ever watched I reccomend this anime 100% to all newcomers and veteran anime watchers,10,Recommended,"Nov 27, 2009",Naruto,Naruto,20,naruto_f77e81ee72,5
